{
  "action_space": {
    "channels": [
      {
        "actuator": "unknown",
        "command_rate_hz": 10,
        "command_timestamp_semantics": "LeRobot timestamp column is preserved as command sample time",
        "control_mode": "joint_position",
        "effective_timestamp_semantics": "source does not declare controller latency; effective time is source-absent",
        "interpolation": "source_absent",
        "latency_model": "source_absent",
        "missing_value_policy": "source_absent",
        "name": "joint_position_vector",
        "parameterization": "absolute_joint_vector",
        "reference_frame": "unknown_joint_space",
        "semantics": "absolute",
        "units": "source_undocumented_position_units"
      }
    ]
  },
  "clock_graph": {
    "clocks": [
      {
        "clock_id": "episode_time",
        "domain": "lerobot_timestamp",
        "units": "s"
      }
    ],
    "mappings": []
  },
  "embodiment": {
    "embodiment_id": "unknown"
  },
  "entities": [
    {
      "entity_id": "unknown",
      "entity_type": "robot",
      "representations": [
        {
          "asset": {
            "license": "Apache-2.0",
            "media_type": "application/json",
            "mirrors": [
              "meta/info.json"
            ],
            "sha256": "0b46becc21ad92b117da1e95daf44110bb21d0bde75638b4ad167c8ccd959d38",
            "uri": "hf://lerobot/pusht@7628202a2180972f291ba1bc6723834921e72c19/meta/info.json"
          },
          "coordinate_frame": "unknown_joint_space",
          "license": "Apache-2.0",
          "representation_id": "unknown_lerobot_schema",
          "role": "semantics",
          "valid_interval": {
            "clock_id": "episode_time",
            "end": 16.0,
            "start": 0
          }
        }
      ]
    }
  ],
  "episode": {
    "dataset_id": "lerobot/pusht",
    "episode_id": "lerobot_pusht_episode_000000",
    "outcome": "source_not_annotated",
    "split": "train"
  },
  "events": [],
  "frame_graph": {
    "frames": [
      {
        "convention": "lerobot-source-joint-vector",
        "frame_id": "unknown_joint_space",
        "units": "rad"
      },
      {
        "convention": "dataset-indexed-observation-frame",
        "frame_id": "unknown_dataset_clock_frame",
        "units": "m"
      }
    ],
    "transforms": []
  },
  "provenance": {
    "creator": "WorldEpisode active LeRobot converter",
    "license": "Apache-2.0 source dataset; derived metadata CC0-1.0",
    "software": "tools/lerobot_worldepisode_roundtrip.py",
    "source": "lerobot/pusht@7628202a2180972f291ba1bc6723834921e72c19"
  },
  "quality": {
    "conformance_profiles": [
      "WE-Core"
    ],
    "source_absent_fields": [
      "camera extrinsics",
      "robot/world calibration transform",
      "action units",
      "controller latency model"
    ],
    "source_native_fields_preserved": [
      "action",
      "observation.state",
      "timestamp",
      "frame_index",
      "episode_index",
      "index",
      "task_index",
      "video timestamp ranges"
    ]
  },
  "schema_version": "worldepisode-0.1",
  "task": {
    "instruction": "Push the T-shaped block onto the T-shaped target.",
    "task_id": "source_task_0"
  },
  "trace": {
    "asset": {
      "license": "Apache-2.0",
      "media_type": "application/vnd.apache.parquet",
      "mirrors": [
        "data/chunk-000/file-000.parquet"
      ],
      "sha256": "9abc0431f12d10c33b5b37b1bf1e6e557c8ae1c8c29fb86658969e48fcbbbf01",
      "uri": "hf://lerobot/pusht@7628202a2180972f291ba1bc6723834921e72c19/data/chunk-000/file-000.parquet"
    },
    "binding": "lerobot-v3"
  },
  "world_deltas": [],
  "world_revision": {
    "asset": {
      "license": "Apache-2.0",
      "media_type": "application/json",
      "mirrors": [
        "meta/info.json"
      ],
      "sha256": "0b46becc21ad92b117da1e95daf44110bb21d0bde75638b4ad167c8ccd959d38",
      "uri": "hf://lerobot/pusht@7628202a2180972f291ba1bc6723834921e72c19/meta/info.json"
    },
    "binding": "lerobot-v3-source-metadata",
    "world_revision_id": "lerobot/pusht@7628202a2180972f291ba1bc6723834921e72c19/metadata@sha256:0b46becc21ad92b117da1e95daf44110bb21d0bde75638b4ad167c8ccd959d38"
  }
}
